{
  "$schema": "https://json-schema.org/draft/2020-12/schema",
  "$id": "https://siegard.dev/schemas/knowledge-authoring-result.v1.json",
  "title": "Knowledge authoring result",
  "description": "Result contract for the knowledge-author agent, the named producer. The named consumer is scripts/orchestrate.py, which chooses the transition out of the implementation phase from the closed `state` field. This artifact carries control flow, so .claude/rules/contracts.md requires this versioned schema and boundary validation before consumption. It is the knowledge-object counterpart of concept-authoring-result/1 and deliberately not a widening of it: schemas/concept.v1.json and schemas/knowledge-object.v1.json are separate vocabularies that never overlap — the knowledge-object contract says so about `term` in as many words — so one result contract covering both would make `producer` a free string and lose the guarantee that a result claiming another producer is not an instance.",
  "type": "object",
  "additionalProperties": false,
  "required": ["contract_version", "producer", "state", "request"],
  "properties": {
    "contract_version": {
      "const": "knowledge-authoring-result/1",
      "description": "A consumer rejects an artifact it was not built to read rather than inferring version from shape."
    },
    "producer": {
      "const": "knowledge-author",
      "description": "The agent this contract belongs to. A const, not a free string: a result claiming another producer is not an instance of this contract."
    },
    "state": {
      "enum": ["authored", "updated", "blocked"],
      "description": "The closed set the consumer branches on: authored = a new knowledge object exists, updated = an existing one was revised, blocked = nothing was written and blocking_reason says why. The same three values as concept-authoring-result/1, because scripts/orchestrate.py maps them to the same implementation-phase outcomes and a fourth would need a transition nothing defines."
    },
    "request": {
      "type": "string",
      "minLength": 1,
      "description": "What was delegated, so a result can be traced to its request without reading either."
    },
    "node_type": {
      "enum": ["definition", "rule", "lifecycle", "interface", "boundary", "process"],
      "description": "Which of the six types specs/0003 closes the vocabulary to. Recorded because the per-type conditionals differ enough that a consumer resolving the object needs to know which branch governs it before reading the file."
    },
    "object_id": {
      "type": "string",
      "pattern": "^ko\\.(definition|rule|lifecycle|interface|boundary|process)\\.[a-z0-9]+(-[a-z0-9]+)*(\\.[a-z0-9]+(-[a-z0-9]+)*)*$",
      "description": "Id of the knowledge object written, matching the id shape of schemas/knowledge-object.v1.json."
    },
    "object_path": {
      "type": "string",
      "minLength": 1,
      "description": "Repository-relative path of the knowledge file written."
    },
    "files_changed": {
      "type": "array",
      "minItems": 1,
      "items": { "type": "string", "minLength": 1 },
      "description": "Every file the agent touched. This is the evidence trail a reviewer diffs against. A derived projection is never in this list: specs/0003 R42 and R51 make those the materializer's output, and an agent that wrote one would be hand-editing a derived artifact."
    },
    "blocking_reason": {
      "type": "string",
      "minLength": 1,
      "description": "Why nothing was written: the missing input, the contradicting object, or the domain fact the request did not supply — named so the caller can act without re-running the agent to find out."
    }
  },
  "allOf": [
    {
      "if": { "properties": { "state": { "const": "blocked" } }, "required": ["state"] },
      "then": { "required": ["blocking_reason"] },
      "else": { "required": ["node_type", "object_id", "object_path", "files_changed"] }
    }
  ],
  "dependentSchemas": {
    "blocking_reason": {
      "required": ["state"],
      "properties": { "state": { "const": "blocked" } },
      "description": "A blocking reason on a successful result is a contradiction; expressed as a dependency so the failure names the offending field."
    }
  }
}
