{
  "contract_version": "knowledge-authoring-result/1",
  "producer": "knowledge-author",
  "state": "updated",
  "request": "record that a cancelled order cannot be invoiced",
  "node_type": "rule",
  "object_id": "ko.rule.sales.cancelled-order-not-billable",
  "object_path": "knowledge/rule/sales/cancelled-order-not-billable.md",
  "files_changed": [
    "knowledge/rule/sales/cancelled-order-not-billable.md",
    "knowledge/lifecycle/sales/order.md"
  ]
}
